Change Name,Area,Priority,Recommendation,Status,Decision Notes
Rebuild hero around one clear service promise,website,high,Make the homepage hero instantly explain that UtahLister creates and posts sharper Marketplace and KSL listings for sellers who want stronger results without doing the work,proposed,Backed by the homepage research brief and trust-first UX research
Use message-matched CTA wording,website,high,Test a primary CTA that directly repeats the hero promise instead of introducing a second concept,proposed,Current best candidate is a direct service CTA such as Get My Listing Done or a close equivalent that matches the final hero copy
Show specific proof in the first two sections,website,high,Move real proof stories and concrete outcomes earlier and keep them specific,proposed,Trek and Dr. Pen style proof should appear early instead of vague optimization claims
Adopt seller-owned posting as the default operating model,operations,high,UtahLister should prepare the listing package and support posting while the seller posts from their own accounts,proposed,This reduces credential risk trust mismatch and pickup logistics problems
Prohibit password collection in the standard workflow,security,high,Do not ask for or store customer passwords as the default service model,proposed,If any exception is ever considered it should require a separate risk review and written process
Use plain-language audience-first copy,copy,medium,Write homepage and intake copy in short direct customer-centered language,proposed,Supports comprehension and trust for a broad audience
Keep persuasion high and deception low,brand,high,Avoid fake scarcity confusing CTA wording and other dark-pattern style tactics,proposed,Long-term trust and defensibility matter more than short-term manipulation
